{
  "schema_version": "1.0.0",
  "library_id": "physui.office.presets.v1",
  "created_at": "2026-03-04",
  "assets": [
    {
      "asset_id": "pattern.diagonal.up_5",
      "asset_type": "pattern",
      "canonical_name_en": "Diagonal Up 5%",
      "canonical_name_zh": "向上对角线 5%",
      "source_standard": "OOXML",
      "source_enum": "ST_PresetPatternVal",
      "source_value": "pct5",
      "tags": ["stripe", "diagonal", "office"],
      "retrieval_features": {
        "orientation_deg": 45.0,
        "period_px_norm": 0.08,
        "duty_cycle": 0.5,
        "anisotropy": 0.92,
        "frequency_peaks": [0.12, 0.24],
        "stochasticity": 0.08
      },
      "param_slots": [
        {
          "name": "fg_color",
          "type": "color",
          "required": true,
          "description_en": "Foreground stripe color",
          "description_zh": "前景条纹颜色"
        },
        {
          "name": "bg_color",
          "type": "color",
          "required": true,
          "description_en": "Background color",
          "description_zh": "背景颜色"
        },
        {
          "name": "stroke_width",
          "type": "float",
          "required": false,
          "default": 1.2,
          "description_en": "Stripe thickness",
          "description_zh": "条纹线宽"
        }
      ],
      "svg_template": "<defs><pattern id='{{id}}' width='{{tile}}' height='{{tile}}' patternUnits='userSpaceOnUse' patternTransform='rotate({{angle}})'><rect width='100%' height='100%' fill='{{bg_color}}'/><line x1='0' y1='0' x2='0' y2='{{tile}}' stroke='{{fg_color}}' stroke-width='{{stroke_width}}'/></pattern></defs>",
      "routing_policy": {
        "min_confidence": 0.7,
        "fallback": "physics_fit"
      },
      "quality_gate": {
        "min_iou": 0.85,
        "max_token_ratio": 0.6,
        "min_soft_iou": 0.9
      },
      "type_specific": {
        "pattern": {
          "orientation_deg": 45.0,
          "tile_ratio": 0.08
        }
      },
      "provenance": {
        "created_from": "ppt_export_sample",
        "license": "internal_research",
        "created_at": "2026-03-04",
        "notes": "Bootstrap template for stripe rewrite route"
      }
    },
    {
      "asset_id": "gradient.linear.office_01",
      "asset_type": "gradient",
      "canonical_name_en": "Office Linear Gradient 01",
      "canonical_name_zh": "Office 线性渐变 01",
      "source_standard": "VBA_MSO",
      "source_enum": "MsoPresetGradientType",
      "source_value": 1,
      "tags": ["gradient", "linear", "office"],
      "retrieval_features": {
        "orientation_deg": 90.0,
        "anisotropy": 0.1,
        "frequency_peaks": []
      },
      "param_slots": [
        {
          "name": "start_color",
          "type": "color",
          "required": true
        },
        {
          "name": "end_color",
          "type": "color",
          "required": true
        }
      ],
      "svg_template": "<linearGradient id='{{id}}' x1='0%' y1='0%' x2='0%' y2='100%'><stop offset='0%' stop-color='{{start_color}}'/><stop offset='100%' stop-color='{{end_color}}'/></linearGradient>",
      "routing_policy": {
        "min_confidence": 0.8,
        "fallback": "keep_original"
      },
      "quality_gate": {
        "min_iou": 0.9,
        "max_token_ratio": 0.75
      },
      "type_specific": {
        "gradient": {
          "gradient_kind": "linear",
          "angle_deg": 90,
          "stops": [
            {
              "offset": 0,
              "color": "#ffffff"
            },
            {
              "offset": 1,
              "color": "#000000"
            }
          ]
        }
      },
      "provenance": {
        "created_from": "office_vba_mapping",
        "license": "internal_research",
        "created_at": "2026-03-04"
      }
    }
  ]
}
